{
  "request_id": "thesis-defense-deck-audit-plan-v2",
  "status": "COMPLETE",
  "results": {
    "q1": "The complete coverage set is D01 artifact identity and provenance; D02 source authority and claim mapping; D03 text-layer and visible-text parity; D04 numerical and specification fidelity; D05 claim strength and inferential boundaries; D06 terminology and cross-slide consistency; D07 citation and authority hygiene; D08 narrative architecture and cognitive economy; D09 quantitative visual integrity; D10 final-PDF rendering and projection robustness; D11 language compliance; D12 timing and spoken-slide interface; D13 examiner attack surface and unresolved gaps; D14 locked-deck triage and remediation governance; and D15 audit-process completeness. The dimension most likely to be underweighted by the deck builder is D13. Builders tend to equate audit quality with artifact correctness, while the defense can still be exposed by thesis-silent procedures, unexplained sample choices, predictable method questions, and counterintuitive facts that are not themselves slide defects.",
    "q2": "The mandatory deterministic checks are artifact hashes and sizes; source-file hashes; PDF page count, page boxes, fonts, and object properties; text and character inventories; page-number sequence; exhaustive numeric-token inventory; exact source-cell equality; all derived arithmetic and rounding; chart coordinate-to-value mapping; sample/specification bundle comparison; forbidden-character searches; raster command, DPI, and pixel dimensions; elapsed rehearsal times; execution-log coverage; dependent-artifact hashes; and ledger assertions. They are unsafe to leave to model judgment because they require exhaustive coverage, exact equality, reproducible arithmetic, coordinate measurement, or binary state detection. Judgment is reserved for semantic support, causal implication, mechanism framing, novelty scope, perceptual hierarchy, audience presupposition, speakability, and defense consequence. Hybrid checks use deterministic enumeration first and human or model judgment only for contextual adjudication.",
    "q3": "Freeze and identify inputs first. Build the authoritative source manifest and claim map second. Establish text-layer parity and language hygiene third. Verify all numbers and specifications fourth. Audit inferential boundaries, terminology, contradictions, and citations fifth. Check quantitative visual encoding sixth and exact final-PDF rendering seventh. Review narrative architecture eighth, timing ninth, and examiner exposure tenth. Only then consolidate findings and apply the locked-deck reopening rule. Finish with blind review, evidence packaging, and completion gates. Speaker-note production starts after the deck is frozen, because drafting against a moving deck creates timing and source-map churn.",
    "q4": "A finding is fixed only when both reopening keys pass: it is an evidence-backed blocker or major violation of the thesis, ledger, or functional final-PDF requirements, and it has a bounded safe patch that can be rendered through canonical WeasyPrint, fully rebuilt, rerasterized at 300 DPI or higher, regression-checked, hashed, rolled back, ledger-updated, and explicitly authorized by the user. A minor or note never opens the deck alone. A confirmed must-fix issue with no safe renderer path remains recorded as BLOCKED; Chrome is not an acceptable substitute.",
    "q5": "Create source-mapped notes only after audit closure. Use the fixed per-slide record in speaker_notes_plan, with each spoken claim linked to an exact thesis location and explicit prohibited-claim guards. Determine the word cap from the presenter's measured rate, cap the draft at 17 minutes, and allocate it by the approved 5:10:3 section ratio. Slide-level caps remain provisional until timed rehearsal because none are user-approved. Require three clean runs at or below 18 minutes, no rushed recovery, full visual alignment, and zero drift into causality, mechanism, cash-only claims, invented procedures, or appendix-only results.",
    "q6": "The plan can fail through missing official requirements, unavailable or ambiguous source versions, anchoring on known candidate issues, committee overfitting, inconsistent semantic judgment, false positives that confuse taste with defects, inadequate room simulation, renderer outage, checklist completion without argument comprehension, perceptual ambiguities missed by text and geometry tools, and unstable rehearsal pace. Each has an observable signal in plan_self_critique, such as an unresolvable source manifest, reviewer disagreement, a blind-pass blocker, a real-room readability failure, or an unresolved D14-C05 renderer block.",
    "q7": "Yes, one later independent review is warranted after the local audit is executed and the first full speaker-notes draft and rehearsal log exist. Its scope must be limited to false-negative detection and triage consistency: identify only missed blocker or major deck defects, unsupported or drifting note claims, missing evidence, and misclassified exposures. It must not redesign slides, propose a new architecture, re-open minor preferences, or draft replacement notes. Inputs must include the final PDF and hash, exact 300-DPI rasters, extracted text, ledger, this plan, completed execution and findings logs, source manifest and claim map, calculation log, dispositions, notes draft and source map, and rehearsal log. The reviewer should not receive the operator's original candidate-finding list until after its blind report.",
    "dimensions": [
      {
        "dimension_id": "D01",
        "name": "Artifact identity, provenance, and frozen baseline",
        "why_it_matters": "Every later conclusion is invalid if the wrong deck, text extraction, or render is audited.",
        "cost_of_failure_at_defense": "The operator may approve or repair a file that is not the production-locked deck, making all downstream work non-reproducible.",
        "checks": [
          {
            "check_id": "D01-C01",
            "what_to_check": "Confirm that the audit target is the exact production PDF recorded in the ledger by filename, byte size, and SHA-256.",
            "evidence_source": "THESIS_DEFENSE_CONTINUITY_LEDGER_REV21(5).json; thesis_defense_main_deck_slides_01-13_standardized_v2(1).pdf",
            "method": "deterministic",
            "method_rationale": "Identity and byte equality are exact facts. Model inspection cannot reliably establish them.",
            "pass_criterion": "The computed SHA-256, byte size, and production role all match the ledger record, with duplicate upload suffixes treated only as storage artifacts.",
            "fail_criterion": "Any mismatch, missing hash record, or ambiguity about which PDF is authoritative.",
            "default_severity": "blocker"
          },
          {
            "check_id": "D01-C02",
            "what_to_check": "Freeze an immutable audit snapshot containing the target PDF, extracted text JSON, ledger, context file, and tool-version record.",
            "evidence_source": "All attached files; locally generated AUDIT_SOURCE_MANIFEST.json",
            "method": "deterministic",
            "method_rationale": "A frozen snapshot prevents later edits or tool changes from silently invalidating evidence.",
            "pass_criterion": "Each input has a recorded path, size, SHA-256, modification time, and role before any check runs.",
            "fail_criterion": "Any input is overwritten, untracked, or used without a recorded hash.",
            "default_severity": "blocker"
          },
          {
            "check_id": "D01-C03",
            "what_to_check": "Record PDF structure facts required for reproducibility: page count, page boxes, embedded fonts, producer, encryption, and annotations.",
            "evidence_source": "Production PDF; PyMuPDF or pdf_inspect output stored in the audit evidence folder",
            "method": "deterministic",
            "method_rationale": "These properties are machine-readable and must not depend on visual estimation.",
            "pass_criterion": "A machine report is saved and all structural facts are internally consistent with the frozen baseline.",
            "fail_criterion": "The report is absent, incomplete, or indicates inconsistent page geometry, missing fonts, encryption, or unexpected interactive content.",
            "default_severity": "major"
          },
          {
            "check_id": "D01-C04",
            "what_to_check": "Separate audit capability from repair capability by recording the canonical renderer state before triage.",
            "evidence_source": "AUDIT_CONTEXT.md; local WeasyPrint dependency test; production_and_qa_workflow in the ledger",
            "method": "deterministic",
            "method_rationale": "Whether the canonical renderer starts successfully is an executable condition, not a matter of opinion.",
            "pass_criterion": "The audit record states either RENDERER_READY with a successful smoke render or RENDERER_BLOCKED with the exact dependency error; no edit is attempted while blocked.",
            "fail_criterion": "A repair is attempted through a different renderer or without a successful canonical-renderer smoke test.",
            "default_severity": "blocker"
          }
        ]
      },
      {
        "dimension_id": "D02",
        "name": "Source authority and claim-to-source traceability",
        "why_it_matters": "The thesis is the sole academic authority, so every substantive slide claim must have a precise source path.",
        "cost_of_failure_at_defense": "An examiner can expose an unsupported statement even when the deck looks polished and internally coherent.",
        "checks": [
          {
            "check_id": "D02-C01",